{
  "schema_version": "1.0.0",
  "manifest_id": "ato-authorities-2026-07-10-draft",
  "status": "draft",
  "created_at": "2026-07-10T22:33:12Z",
  "approved_at": null,
  "approved_by": null,
  "sources": [
    {
      "authority_id": "fedramp-consolidated-rules-2026",
      "title": "FedRAMP Consolidated Rules for 2026",
      "source_url": "https://raw.githubusercontent.com/FedRAMP/rules/7227d7f54397213799c1ad8255301b4ca1f88e1d/fedramp-consolidated-rules.json",
      "source_version_or_date": "git:7227d7f54397213799c1ad8255301b4ca1f88e1d",
      "retrieved_at_utc": "2026-07-10T22:33:12Z",
      "effective_date": "2026-06-24",
      "sha256": "6e97f7913d1b9a6294ddb4505b66833c688ecd1ff8a27569943f6096410e4532",
      "size_bytes": 566791,
      "local_path": "reference/authorities/fedramp/fedramp-consolidated-rules-2026.json",
      "review_status": "pending",
      "notes": "Exact pinned bytes are vendored and digest-verified. Applicable Program/Class C rules still require qualified human review before this source can be marked reviewed."
    },
    {
      "authority_id": "fedramp-schema-common-2026-06-24",
      "title": "FedRAMP Common Definitions Schema",
      "source_url": "https://www.fedramp.gov/schemas/fedramp-common-definitions-schema-2026-06-24.json",
      "source_version_or_date": "2026-06-24",
      "retrieved_at_utc": "2026-07-10T22:33:12Z",
      "effective_date": "2026-06-24",
      "sha256": "07d70d4dabf8010d913e678eaadf5ae3c78ab7602be506d8b689e95cfc046f55",
      "size_bytes": 4489,
      "local_path": "reference/authorities/fedramp/fedramp-common-definitions-schema-2026-06-24.json",
      "review_status": "pending",
      "notes": "Exact pinned bytes are vendored and digest-verified; schema review remains pending."
    },
    {
      "authority_id": "fedramp-schema-cpo-2026-06-24",
      "title": "FedRAMP Certification Package Overview Schema",
      "source_url": "https://www.fedramp.gov/schemas/fedramp-certification-package-overview-schema-2026-06-24.json",
      "source_version_or_date": "2026-06-24",
      "retrieved_at_utc": "2026-07-10T22:33:12Z",
      "effective_date": "2026-06-24",
      "sha256": "14a7afcec4c9d638470b7151d822c3b3d8cbb08a7029962cb24a676a57216fb3",
      "size_bytes": 9699,
      "local_path": "reference/authorities/fedramp/fedramp-certification-package-overview-schema-2026-06-24.json",
      "review_status": "pending",
      "notes": "Exact pinned bytes are vendored and digest-verified; schema review remains pending."
    },
    {
      "authority_id": "fedramp-schema-sdr-2026-06-24",
      "title": "FedRAMP Security Decision Record Schema",
      "source_url": "https://www.fedramp.gov/schemas/fedramp-security-decision-record-schema-2026-06-24.json",
      "source_version_or_date": "2026-06-24",
      "retrieved_at_utc": "2026-07-10T22:33:12Z",
      "effective_date": "2026-06-24",
      "sha256": "361f3322a4da2fd8370f8941002264494b9781807a09b5a8b9913d9a807ac38a",
      "size_bytes": 7227,
      "local_path": "reference/authorities/fedramp/fedramp-security-decision-record-schema-2026-06-24.json",
      "review_status": "pending",
      "notes": "Exact pinned bytes are vendored and digest-verified; schema review remains pending."
    },
    {
      "authority_id": "fedramp-schema-ocr-2026-06-24",
      "title": "FedRAMP Ongoing Certification Report Schema",
      "source_url": "https://www.fedramp.gov/schemas/fedramp-ongoing-certification-report-schema-2026-06-24.json",
      "source_version_or_date": "2026-06-24",
      "retrieved_at_utc": "2026-07-10T22:33:12Z",
      "effective_date": "2026-06-24",
      "sha256": "67fc27322930ccd76cee27b5f2f558fe1a2bb0956a7e7a7c9bc0732662af406a",
      "size_bytes": 3381,
      "local_path": "reference/authorities/fedramp/fedramp-ongoing-certification-report-schema-2026-06-24.json",
      "review_status": "pending",
      "notes": "Exact pinned bytes are vendored and digest-verified; schema review remains pending."
    },
    {
      "authority_id": "fedramp-schema-accepted-vulnerability-2026-06-24",
      "title": "FedRAMP Accepted Vulnerability Information Schema",
      "source_url": "https://www.fedramp.gov/schemas/fedramp-accepted-vulnerability-info-schema-2026-06-24.json",
      "source_version_or_date": "2026-06-24",
      "retrieved_at_utc": "2026-07-10T22:33:12Z",
      "effective_date": "2026-06-24",
      "sha256": "f3dcb0211ddb1d194a764b90fbb173e84be29f71e835f5c9df775fd8f4ed4f37",
      "size_bytes": 1268,
      "local_path": "reference/authorities/fedramp/fedramp-accepted-vulnerability-info-schema-2026-06-24.json",
      "review_status": "pending",
      "notes": "Supporting 20x package schema; exact pinned bytes are vendored and digest-verified, with review pending."
    },
    {
      "authority_id": "fedramp-schema-historical-ver-2026-06-24",
      "title": "FedRAMP Historical Vulnerability Evaluation and Reporting Activity Schema",
      "source_url": "https://www.fedramp.gov/schemas/fedramp-historical-ver-activity-schema-2026-06-24.json",
      "source_version_or_date": "2026-06-24",
      "retrieved_at_utc": "2026-07-10T22:33:12Z",
      "effective_date": "2026-06-24",
      "sha256": "497e2358cf72ccd886b363543d752825342d49a693581f8f6fd5bcd13ccfc24a",
      "size_bytes": 1439,
      "local_path": "reference/authorities/fedramp/fedramp-historical-ver-activity-schema-2026-06-24.json",
      "review_status": "pending",
      "notes": "Supporting 20x package schema; exact pinned bytes are vendored and digest-verified, with review pending."
    },
    {
      "authority_id": "fedramp-schema-incident-2026-06-24",
      "title": "FedRAMP Incident Report Schema",
      "source_url": "https://www.fedramp.gov/schemas/fedramp-incident-report-schema-2026-06-24.json",
      "source_version_or_date": "2026-06-24",
      "retrieved_at_utc": "2026-07-10T22:33:12Z",
      "effective_date": "2026-06-24",
      "sha256": "cad5b306179142d3db3134bac868586db87d5e7fe8d97a31db42fd9fe8613cb9",
      "size_bytes": 4041,
      "local_path": "reference/authorities/fedramp/fedramp-incident-report-schema-2026-06-24.json",
      "review_status": "pending",
      "notes": "Supporting 20x package schema; exact pinned bytes are vendored and digest-verified, with review pending."
    },
    {
      "authority_id": "fedramp-schema-significant-change-2026-06-24",
      "title": "FedRAMP Significant Change Notification Schema",
      "source_url": "https://www.fedramp.gov/schemas/fedramp-significant-change-notifications-schema-2026-06-24.json",
      "source_version_or_date": "2026-06-24",
      "retrieved_at_utc": "2026-07-10T22:33:12Z",
      "effective_date": "2026-06-24",
      "sha256": "af492199332d608a0f4346c8955f89be0888c07495c4da8e9b003d8a51794017",
      "size_bytes": 2929,
      "local_path": "reference/authorities/fedramp/fedramp-significant-change-notifications-schema-2026-06-24.json",
      "review_status": "pending",
      "notes": "Supporting 20x package schema; exact pinned bytes are vendored and digest-verified, with review pending."
    },
    {
      "authority_id": "fedramp-schema-vulnerability-detail-2026-06-24",
      "title": "FedRAMP Vulnerability Detail Report Schema",
      "source_url": "https://www.fedramp.gov/schemas/fedramp-vulnerability-detail-report-schema-2026-06-24.json",
      "source_version_or_date": "2026-06-24",
      "retrieved_at_utc": "2026-07-10T22:33:12Z",
      "effective_date": "2026-06-24",
      "sha256": "70d53c3c8a2d63cc8af893bceaa1714adce234f5f24d1569278835b1eb14ab88",
      "size_bytes": 1216,
      "local_path": "reference/authorities/fedramp/fedramp-vulnerability-detail-report-schema-2026-06-24.json",
      "review_status": "pending",
      "notes": "Supporting 20x package schema; exact pinned bytes are vendored and digest-verified, with review pending."
    },
    {
      "authority_id": "nist-sp800-53-release-5.2.0",
      "title": "NIST SP 800-53, 53A, and 53B Release 5.2.0 source catalog",
      "source_url": "https://github.com/usnistgov/oscal-content/releases/download/v1.5.0/oscal-content-1.5.0.zip",
      "source_version_or_date": "SP 800-53 5.2.0 in oscal-content v1.5.0",
      "retrieved_at_utc": "2026-07-10T22:51:54Z",
      "effective_date": "2026-05-13",
      "sha256": "2fe26ac1087f49736e75be84f2b23333050e2227fac51f899b2ca4bd5e1109f4",
      "size_bytes": 12554879,
      "local_path": "reference/authorities/nist/oscal-content-1.5.0.zip",
      "review_status": "pending",
      "notes": "Official release archive is vendored and digest-verified. Scope review for the 53/53A catalog and 53B security baselines remains pending; privacy baseline content is out of product scope."
    },
    {
      "authority_id": "nist-oscal-1.2.2",
      "title": "NIST OSCAL 1.2.2 schemas and metaschemas",
      "source_url": "https://github.com/usnistgov/OSCAL/releases/download/v1.2.2/oscal-1.2.2.zip",
      "source_version_or_date": "1.2.2",
      "retrieved_at_utc": "2026-07-10T22:51:54Z",
      "effective_date": "2026-04-30",
      "sha256": "d2935239d3eac06cd65ed77295b92023bb3921e035755b89c87e7e42bd4b85a4",
      "size_bytes": 748611,
      "local_path": "reference/authorities/nist/oscal-1.2.2.zip",
      "review_status": "pending",
      "notes": "Official release archive is vendored and digest-verified. Customer/GRC toolchain compatibility qualification remains pending."
    }
  ]
}
